<?xml version="1.0" encoding="UTF-8"?>
<announcements xmlns:xsi="http://www.w3.org/2001/XMLSchema-instance" xsi:noNamespaceSchemaLocation="shop.xsd">
	<section id="1">
		<title>Яндекс.Деньги разрешили передавать идентификацию по наследству</title>
		<para>Теперь пользователи, у которых есть хотя бы один идентифицированный кошелек, могут идентифицировать остальные — не выходя из дома. Пользователи открывают несколько кошельков для разных целей. Например, так удобнее отслеживать поступление денег по каждой благотворительной акции. Кроме того, если меняется адрес на Яндекс.Почте, проще создать новый кошелек под новым логином. Теперь идентифицировать «запасные» счета можно в несколько кликов — сервис позволяет скопировать паспортные данные из одного кошелька в другой.</para>
	</section>
	<section id="2">
		<title>Яндекс.Деньги покажут штрафы ГИБДД</title>
		<para>В Яндекс.Деньгах появилась новая услуга — проверка задолженностей по штрафам ГИБДД. Теперь любой пользователь рунета может получить информацию о своих штрафах и сразу оплатить каждый из них (даже если у него нет электронного кошелька).</para>
		<para>Для проверки понадобится только номер водительского удостоверения и свидетельства о регистрации автомобиля. Поиск по этим данным ведется в Государственной информационной системе о государственных и муниципальных платежах (ГИС ГМП) среди штрафов, выставленных с лета 2013 года. В результате пользователь увидит, когда было выписано постановление, дату, до которой нужно погасить задолженность, и сумму штрафа.</para>
	</section>
	<section id="3">
		<title>Яндекс.Деньги включили Кассу всем пользователям Nethouse</title>
		<para>Теперь пользователи конструктора сайтов Nethouse могут принимать онлайн-платежи через Кассу от Яндекс.Денег.</para>
		<para>На базе Nethouse создано 320 тысяч сайтов, около 40% из них — интернет-магазины.</para>
		<para>Теперь каждый из них может предложить посетителям выбрать удобный способ оплаты: с электронных кошельков Яндекс.Денег и Webmoney, банковских карт Visa и Visa Electron, MasterCard и Maestro, а также наличными через терминалы и салоны связи (всего более 170 тыс точек приема оплаты).</para>
	</section>
</announcements>
